<?xml version="1.0" encoding="utf-8" standalone="no"?>
<!DOCTYPE idon-map SYSTEM "idon-map.dtd">
<idon-map> 
<map-name>Xml Reader Test Map</map-name>
<cell-size>55</cell-size>
    <idons>
        <idon>
            <coord><x-coord>78</x-coord><y-coord>77</y-coord></coord>    
            <idea>Is this thing on?</idea>    
            <color><red>0</red><green>255</green><blue>255</blue></color>
        </idon>
        <idon>
            <coord><x-coord>79</x-coord><y-coord>77</y-coord></coord>    
            <idea>Yes it is</idea>    
            <color><red>0</red><green>255</green><blue>255</blue></color>
        </idon>
    </idons>
    <suggestions>
        <suggestion>blah1</suggestion>
        <suggestion>blah2</suggestion>
    </suggestions>
    <view-position>
        <height>501</height><width>762</width><x-pos>7049</x-pos><y-pos>6105</y-pos>
    </view-position>
</idon-map>
