<?xml version="1.0" encoding="utf-8" standalone="no"?>
<!DOCTYPE idon-map SYSTEM "idon-map.dtd">
<idon-map>
<map-name>xmlReaderTest2.xml</map-name>
<cell-size>55.0</cell-size>
<idons>
<idon>
<coord>
<x-coord>79</x-coord>
<y-coord>79</y-coord>
</coord>
<idea>YES IT IS</idea>
<color>
<red>0</red>
<green>255</green>
<blue>255</blue>
</color>
</idon>
<idon>
<coord>
<x-coord>78</x-coord>
<y-coord>78</y-coord>
</coord>
<idea>IS THIS THING ON?</idea>
<color>
<red>0</red>
<green>255</green>
<blue>255</blue>
</color>
</idon>
</idons>
<suggestions>
<suggestion>blah1</suggestion>
<suggestion>blah2</suggestion>
</suggestions>
<view-position>
<height>480</height>
<width>762</width>
<x-pos>7049</x-pos>
<y-pos>6135</y-pos>
</view-position>
</idon-map>
